{
  "schema": "bricksmith.scene.v1",
  "name": "Orbiter — full-catalog visual prototype",
  "description": "Host-authored shuttle with curved fuselage and nose, genuine diagonal wing/root plates, swept thin tail and rotated round engine bells. Visual prototype: some joins/interpenetrations and cantilevered assemblies are not mechanically solved. No buildability claim or inferred instructions.",
  "units": "LDU",
  "libraryDigest": "420a5e61759391a217bc5d22cb3867f2275f8efa5ef5fec11b1e97b86991a666",
  "parts": [
    {
      "id": "starboard-wing-heatshield",
      "part": "30355",
      "color": 0,
      "position": [
        140,
        0,
        100
      ],
      "rotation": [
        1,
        0,
        0,
        0,
        1,
        0,
        0,
        0,
        1
      ]
    },
    {
      "id": "starboard-root-heatshield",
      "part": "3544",
      "color": 0,
      "position": [
        110,
        0,
        -100
      ],
      "rotation": [
        1,
        0,
        0,
        0,
        1,
        0,
        0,
        0,
        1
      ]
    },
    {
      "id": "starboard-wing-surface",
      "part": "30355",
      "color": 15,
      "position": [
        140,
        -8,
        100
      ],
      "rotation": [
        1,
        0,
        0,
        0,
        1,
        0,
        0,
        0,
        1
      ]
    },
    {
      "id": "starboard-root-surface",
      "part": "3544",
      "color": 15,
      "position": [
        110,
        -8,
        -100
      ],
      "rotation": [
        1,
        0,
        0,
        0,
        1,
        0,
        0,
        0,
        1
      ]
    },
    {
      "id": "port-wing-heatshield",
      "part": "30356",
      "color": 0,
      "position": [
        -140,
        0,
        100
      ],
      "rotation": [
        1,
        0,
        0,
        0,
        1,
        0,
        0,
        0,
        1
      ]
    },
    {
      "id": "port-root-heatshield",
      "part": "3545",
      "color": 0,
      "position": [
        -110,
        0,
        -100
      ],
      "rotation": [
        1,
        0,
        0,
        0,
        1,
        0,
        0,
        0,
        1
      ]
    },
    {
      "id": "port-wing-surface",
      "part": "30356",
      "color": 15,
      "position": [
        -140,
        -8,
        100
      ],
      "rotation": [
        1,
        0,
        0,
        0,
        1,
        0,
        0,
        0,
        1
      ]
    },
    {
      "id": "port-root-surface",
      "part": "3545",
      "color": 15,
      "position": [
        -110,
        -8,
        -100
      ],
      "rotation": [
        1,
        0,
        0,
        0,
        1,
        0,
        0,
        0,
        1
      ]
    },
    {
      "id": "belly--100",
      "part": "3036",
      "color": 0,
      "position": [
        0,
        0,
        -100
      ],
      "rotation": [
        1,
        0,
        0,
        0,
        1,
        0,
        0,
        0,
        1
      ]
    },
    {
      "id": "belly-20",
      "part": "3036",
      "color": 0,
      "position": [
        0,
        0,
        20
      ],
      "rotation": [
        1,
        0,
        0,
        0,
        1,
        0,
        0,
        0,
        1
      ]
    },
    {
      "id": "belly-140",
      "part": "3036",
      "color": 0,
      "position": [
        0,
        0,
        140
      ],
      "rotation": [
        1,
        0,
        0,
        0,
        1,
        0,
        0,
        0,
        1
      ]
    },
    {
      "id": "belly-aft",
      "part": "3034",
      "color": 0,
      "position": [
        0,
        0,
        220
      ],
      "rotation": [
        1,
        0,
        0,
        0,
        1,
        0,
        0,
        0,
        1
      ]
    },
    {
      "id": "lower-skin--100",
      "part": "3036",
      "color": 15,
      "position": [
        0,
        -8,
        -100
      ],
      "rotation": [
        1,
        0,
        0,
        0,
        1,
        0,
        0,
        0,
        1
      ]
    },
    {
      "id": "lower-skin-20",
      "part": "3036",
      "color": 15,
      "position": [
        0,
        -8,
        20
      ],
      "rotation": [
        1,
        0,
        0,
        0,
        1,
        0,
        0,
        0,
        1
      ]
    },
    {
      "id": "lower-skin-140",
      "part": "3036",
      "color": 15,
      "position": [
        0,
        -8,
        140
      ],
      "rotation": [
        1,
        0,
        0,
        0,
        1,
        0,
        0,
        0,
        1
      ]
    },
    {
      "id": "lower-skin-aft",
      "part": "3034",
      "color": 15,
      "position": [
        0,
        -8,
        220
      ],
      "rotation": [
        1,
        0,
        0,
        0,
        1,
        0,
        0,
        0,
        1
      ]
    },
    {
      "id": "upper-deck--100",
      "part": "3036",
      "color": 15,
      "position": [
        0,
        -40,
        -100
      ],
      "rotation": [
        1,
        0,
        0,
        0,
        1,
        0,
        0,
        0,
        1
      ]
    },
    {
      "id": "upper-deck-20",
      "part": "3036",
      "color": 15,
      "position": [
        0,
        -40,
        20
      ],
      "rotation": [
        1,
        0,
        0,
        0,
        1,
        0,
        0,
        0,
        1
      ]
    },
    {
      "id": "upper-deck-140",
      "part": "3036",
      "color": 15,
      "position": [
        0,
        -40,
        140
      ],
      "rotation": [
        1,
        0,
        0,
        0,
        1,
        0,
        0,
        0,
        1
      ]
    },
    {
      "id": "upper-deck-aft",
      "part": "3034",
      "color": 15,
      "position": [
        0,
        -40,
        220
      ],
      "rotation": [
        1,
        0,
        0,
        0,
        1,
        0,
        0,
        0,
        1
      ]
    },
    {
      "id": "wall--60--120",
      "part": "3001",
      "color": 15,
      "position": [
        -60,
        -32,
        -120
      ],
      "rotation": [
        0,
        0,
        1,
        0,
        1,
        0,
        -1,
        0,
        0
      ]
    },
    {
      "id": "wall--60--40",
      "part": "3001",
      "color": 15,
      "position": [
        -60,
        -32,
        -40
      ],
      "rotation": [
        0,
        0,
        1,
        0,
        1,
        0,
        -1,
        0,
        0
      ]
    },
    {
      "id": "wall--60-40",
      "part": "3001",
      "color": 15,
      "position": [
        -60,
        -32,
        40
      ],
      "rotation": [
        0,
        0,
        1,
        0,
        1,
        0,
        -1,
        0,
        0
      ]
    },
    {
      "id": "wall--60-120",
      "part": "3001",
      "color": 15,
      "position": [
        -60,
        -32,
        120
      ],
      "rotation": [
        0,
        0,
        1,
        0,
        1,
        0,
        -1,
        0,
        0
      ]
    },
    {
      "id": "wall--60-200",
      "part": "3001",
      "color": 15,
      "position": [
        -60,
        -32,
        200
      ],
      "rotation": [
        0,
        0,
        1,
        0,
        1,
        0,
        -1,
        0,
        0
      ]
    },
    {
      "id": "wall--20--120",
      "part": "3001",
      "color": 15,
      "position": [
        -20,
        -32,
        -120
      ],
      "rotation": [
        0,
        0,
        1,
        0,
        1,
        0,
        -1,
        0,
        0
      ]
    },
    {
      "id": "wall--20--40",
      "part": "3001",
      "color": 15,
      "position": [
        -20,
        -32,
        -40
      ],
      "rotation": [
        0,
        0,
        1,
        0,
        1,
        0,
        -1,
        0,
        0
      ]
    },
    {
      "id": "wall--20-40",
      "part": "3001",
      "color": 15,
      "position": [
        -20,
        -32,
        40
      ],
      "rotation": [
        0,
        0,
        1,
        0,
        1,
        0,
        -1,
        0,
        0
      ]
    },
    {
      "id": "wall--20-120",
      "part": "3001",
      "color": 15,
      "position": [
        -20,
        -32,
        120
      ],
      "rotation": [
        0,
        0,
        1,
        0,
        1,
        0,
        -1,
        0,
        0
      ]
    },
    {
      "id": "wall--20-200",
      "part": "3001",
      "color": 15,
      "position": [
        -20,
        -32,
        200
      ],
      "rotation": [
        0,
        0,
        1,
        0,
        1,
        0,
        -1,
        0,
        0
      ]
    },
    {
      "id": "wall-20--120",
      "part": "3001",
      "color": 15,
      "position": [
        20,
        -32,
        -120
      ],
      "rotation": [
        0,
        0,
        1,
        0,
        1,
        0,
        -1,
        0,
        0
      ]
    },
    {
      "id": "wall-20--40",
      "part": "3001",
      "color": 15,
      "position": [
        20,
        -32,
        -40
      ],
      "rotation": [
        0,
        0,
        1,
        0,
        1,
        0,
        -1,
        0,
        0
      ]
    },
    {
      "id": "wall-20-40",
      "part": "3001",
      "color": 15,
      "position": [
        20,
        -32,
        40
      ],
      "rotation": [
        0,
        0,
        1,
        0,
        1,
        0,
        -1,
        0,
        0
      ]
    },
    {
      "id": "wall-20-120",
      "part": "3001",
      "color": 15,
      "position": [
        20,
        -32,
        120
      ],
      "rotation": [
        0,
        0,
        1,
        0,
        1,
        0,
        -1,
        0,
        0
      ]
    },
    {
      "id": "wall-20-200",
      "part": "3001",
      "color": 15,
      "position": [